{
  "$schema": "https://json-schema.org/draft/2020-12/schema",
  "$id": "https://research-harness.dev/schema/session-state.schema.json",
  "title": "Session State Checkpoint",
  "description": "A durable, disk-derived checkpoint for resumable research sessions (SPEC §6b continuity). scripts/reconcile-session.sh derives this from reports/<topic>/findings/ and a defensive flat reports/<topic>/finding-*.json on disk (plus, when it exists, the cross-topic reports/concordance{,-status}.json one level up, which populates the optional concordance block) so that /resume never reworks completed findings: a finding is DONE once it is schema-valid (validity requires extensions.harness.verification with a verdict, so a valid finding has been through the falsification gate) and not falsified. Partial/invalid findings and *.tmp partial writes are excluded from done-counts. The checkpoint carries no wall-clock field so reconcile is byte-deterministic (the optional concordance block's wall-clock validated_at is deliberately kept out, in reports/concordance-status.json).",
  "type": "object",
  "required": ["topic", "findings", "dimensions", "checks"],
  "additionalProperties": false,
  "properties": {
    "topic": { "type": "string", "minLength": 1 },
    "findings": {
      "type": "array",
      "description": "One record per non-tmp finding file on disk, sorted by id.",
      "items": {
        "type": "object",
        "required": ["id", "dimension", "valid", "attempted_at", "verdict"],
        "additionalProperties": false,
        "properties": {
          "id": { "type": "string", "minLength": 1 },
          "dimension": { "type": "string" },
          "valid": {
            "type": "boolean",
            "description": "True iff the finding validates against schemas/findings.schema.json (ajv exit 0)."
          },
          "attempted_at": {
            "type": ["string", "null"],
            "description": "extensions.harness.verification.attempted_at, or null if the gate has not stamped it."
          },
          "verdict": {
            "type": ["string", "null"],
            "description": "extensions.harness.verification.verdict (falsified|weakened|survived|inconclusive), or null."
          }
        }
      }
    },
    "dimensions": {
      "type": "object",
      "description": "Per config-declared dimension: total non-tmp findings vs done (valid AND gated). Invalid/partial findings count toward total but never toward done.",
      "additionalProperties": {
        "type": "object",
        "required": ["total", "done"],
        "additionalProperties": false,
        "properties": {
          "total": { "type": "integer", "minimum": 0 },
          "done": { "type": "integer", "minimum": 0 }
        }
      }
    },
    "checks": {
      "type": "array",
      "description": "Per completion-condition check: its pass/fail as computed from disk.",
      "items": {
        "type": "object",
        "required": ["check", "passed"],
        "additionalProperties": false,
        "properties": {
          "check": { "type": "string", "minLength": 1 },
          "passed": { "type": "boolean" }
        }
      }
    },
    "concordance": {
      "type": "object",
      "description": "Cross-topic ontological-spine status as of the last reconcile (ADR-0011). built/valid/nodes/edges describe the corpus reports/concordance.json; untyped_shippable is THIS topic's count of survived|weakened findings lacking a valid ontology type (0 in a synthesizable state). Optional — absent when no concordance.json has been built yet. The wall-clock validated_at lives in reports/concordance-status.json, not here, so reconcile stays byte-deterministic.",
      "required": ["built", "valid", "untyped_shippable"],
      "additionalProperties": false,
      "properties": {
        "built": { "type": "boolean", "description": "reports/concordance.json exists." },
        "valid": { "type": "boolean", "description": "validate-concordance.sh exit 0, read from reports/concordance-status.json." },
        "nodes": { "type": "integer", "minimum": 0 },
        "edges": { "type": "integer", "minimum": 0 },
        "untyped_shippable": { "type": "integer", "minimum": 0, "description": "Survived|weakened findings in this topic whose ontology-map basis is untyped/unresolved or invalid, or missing from the map. >0 means the ADR-0011 gate would block synthesis." }
      }
    }
  }
}
